{
  "$schema": "https://json-schema.org/draft/2020-12/schema",
  "$id": "tauceti.round/v1",
  "title": "Review round record",
  "description": "One runner invocation over a PR — a scheduling envelope, not an evaluation unit. Rounds halt on a block verdict, skip on budget, or run a single contested rubric, so they are routinely partial; analyse runs, not rounds.",
  "type": "object",
  "required": ["schema", "round_id", "repo", "pr", "round"],
  "properties": {
    "schema": {"const": "tauceti.round/v1"},
    "round_id": {"type": "string", "description": "<pr>-<round> for production rounds; <pr>-<round>-<arm-label>-<disc> for shadow rounds, where <disc> is a short per-execution hash that keeps re-runs of an arm distinct. A trailing -<12 hex> may also appear on any id when the store's collision backstop preserved a same-path/different-content record."},
    "repo": {"type": "string"},
    "pr": {"type": "integer"},
    "round": {"type": "integer"},
    "ts": {"type": ["string", "null"], "format": "date-time"},
    "mode": {"type": ["string", "null"]},
    "arm": {"type": ["string", "null"]},
    "source": {"enum": ["live", "shadow", "backfill-ledger", "backfill-reviews-branch",
                         "backfill-scrape", null]},
    "head_sha": {"type": ["string", "null"]},
    "base_ref_oid": {"type": ["string", "null"]},
    "merge_base_sha": {"type": ["string", "null"]},
    "rubrics_sha": {"type": ["string", "null"]},
    "rubrics_version": {"type": ["string", "null"]},
    "diff_sha256": {"type": ["string", "null"]},
    "diff_blob": {"type": ["string", "null"]},
    "ran": {"type": ["array", "null"], "items": {"type": "string"}},
    "run_ids": {"type": ["array", "null"], "items": {"type": "string"}},
    "states": {"type": ["object", "null"], "description": "per-rubric state after the round (green/stale/blocking_request/...)"},
    "overall": {"type": ["string", "null"]},
    "cost": {"type": ["number", "null"]},
    "cost_legacy": {"type": ["number", "null"], "description": "the pre-recost cost, retained when this round's cost was recosted against a fixed price table"},
    "cost_recosted": {"type": ["boolean", "null"], "description": "true when cost was recomputed from the constituent runs after recosting; cost_legacy holds the original"},
    "halted_at": {"type": ["string", "null"]},
    "scoreboard_sha256": {"type": ["string", "null"], "description": "sha256 of the rendered scoreboard body for this round"},
    "scoreboard_blob": {"type": ["string", "null"], "description": "blobs/ key of the rendered scoreboard body, when archived"},
    "duration_s": {"type": ["number", "null"], "description": "round wall-clock; for reconstructed rounds possibly log-mined (see duration_source)"},
    "duration_source": {"type": ["string", "null"]},
    "fidelity": {"enum": ["exact", "reconstructed", "scoreboard-parse", null]}
  }
}
