{
  "arm": "production",
  "base_ref_oid": "da5504bc53145726284ff579ea713a3b8e603ba0",
  "cost": 3.85953,
  "duration_s": 307.0,
  "duration_source": "log-mtime",
  "fidelity": "reconstructed",
  "head_sha": "958e3029b16efd109a14f9c58a9f1ead063104dd",
  "mode": "commit",
  "pr": 81,
  "ran": [
    "reuse",
    "scope",
    "correctness",
    "attribution",
    "api-design",
    "generality",
    "placement",
    "naming",
    "documentation",
    "proof-quality",
    "deprecation"
  ],
  "repo": "FormalFrontier/TauCeti",
  "round": 14,
  "round_id": "81-14",
  "rubrics_version": "68ec685af806ec41",
  "run_ids": [
    "r-20260610T051906Z-81-reuse-760937",
    "r-20260610T051906Z-81-scope-6a9270",
    "r-20260610T051906Z-81-correctness-2f2562",
    "r-20260610T051906Z-81-attribution-f6052d",
    "r-20260610T051906Z-81-api-design-ec4cfa",
    "r-20260610T051906Z-81-generality-8a03b9",
    "r-20260610T051906Z-81-placement-fe28f1",
    "r-20260610T051906Z-81-naming-ce2a3e",
    "r-20260610T051906Z-81-documentation-cb9398",
    "r-20260610T051906Z-81-proof-quality-9d152a",
    "r-20260610T051906Z-81-deprecation-d5d31d"
  ],
  "schema": "tauceti.round/v1",
  "scoreboard_blob": "7c0437f34c0a3a2627a60ba705da191f26916c2aa1f82429d70ccddb33f3faf7",
  "scoreboard_sha256": "7c0437f34c0a3a2627a60ba705da191f26916c2aa1f82429d70ccddb33f3faf7",
  "source": "backfill-ledger",
  "states": {
    "api-design": "blocking_request",
    "attribution": "green",
    "correctness": "green",
    "deprecation": "green",
    "documentation": "green",
    "generality": "green",
    "naming": "green",
    "placement": "green",
    "proof-quality": "green",
    "reuse": "green",
    "scope": "green"
  },
  "ts": "2026-06-10T05:19:06.664376+00:00",
  "cost_legacy": 0.993979,
  "cost_recosted": true
}
