{
  "arm": "production",
  "base_ref_oid": "bbe45f4c944bbda92ff9a3252d6f5df8e7d11145",
  "cost": 6.94076,
  "duration_s": 388.0,
  "duration_source": "log-mtime",
  "fidelity": "reconstructed",
  "head_sha": "fbfa202304ce850600f5fd1d1a4671d8277cafeb",
  "mode": "commit",
  "pr": 112,
  "ran": [
    "scope",
    "correctness",
    "reuse",
    "attribution",
    "api-design",
    "generality",
    "placement",
    "naming",
    "documentation",
    "proof-quality",
    "deprecation"
  ],
  "repo": "FormalFrontier/TauCeti",
  "round": 1,
  "round_id": "112-1",
  "rubrics_version": "68ec685af806ec41",
  "run_ids": [
    "r-20260610T081605Z-112-scope-60cc29",
    "r-20260610T081605Z-112-correctness-f4060b",
    "r-20260610T081605Z-112-reuse-dc4be8",
    "r-20260610T081605Z-112-attribution-468621",
    "r-20260610T081605Z-112-api-design-2fc950",
    "r-20260610T081605Z-112-generality-e1c797",
    "r-20260610T081605Z-112-placement-aecfc4",
    "r-20260610T081605Z-112-naming-d30b72",
    "r-20260610T081605Z-112-documentation-3efc51",
    "r-20260610T081605Z-112-proof-quality-27404a",
    "r-20260610T081605Z-112-deprecation-24535f"
  ],
  "schema": "tauceti.round/v1",
  "scoreboard_blob": "6a956168ad5beabe78816b5a397fadec4a612ae4cdc6fc08d4fcec2b49bd9570",
  "scoreboard_sha256": "6a956168ad5beabe78816b5a397fadec4a612ae4cdc6fc08d4fcec2b49bd9570",
  "source": "backfill-ledger",
  "states": {
    "api-design": "blocking_request",
    "attribution": "green",
    "correctness": "green",
    "deprecation": "green",
    "documentation": "green",
    "generality": "green",
    "naming": "green",
    "placement": "blocking_request",
    "proof-quality": "green",
    "reuse": "green",
    "scope": "green"
  },
  "ts": "2026-06-10T08:16:05.653419+00:00",
  "cost_legacy": 1.772951,
  "cost_recosted": true
}
